{
  "$schema": "https://json-schema.org/draft/2020-12/schema",
  "$id": "https://hellochapter.com/schemas/chapter-capture/v1/sketch-measurements.schema.json",
  "title": "SketchMeasurements",
  "description": "What the operator entered for one sketch capture (spec F14): the rooms as drawn, the walls around each room in order, the lengths, diagonals and openings that were measured, and the ceiling height. The sketch solver turns this into the capture model; the file is kept unchanged as the capture's original, next to the sketch image, as Original Exports/{areaKey}/{captureId}/sketch-measurements.json with role sketch_measurements. Lengths are stored in millimetres with the unit and text the operator entered. Optional fields are omitted, never null.",
  "type": "object",
  "additionalProperties": false,
  "required": [
    "schemaVersion",
    "visitId",
    "captureId",
    "areaKey",
    "displayUnits",
    "source",
    "rooms"
  ],
  "properties": {
    "schemaVersion": {
      "const": "1.0.0"
    },
    "visitId": {
      "$ref": "#/$defs/uuid"
    },
    "captureId": {
      "$ref": "#/$defs/uuid"
    },
    "areaKey": {
      "$ref": "#/$defs/areaKey"
    },
    "displayUnits": {
      "description": "The unit system the operator worked in.",
      "enum": ["metric", "imperial"]
    },
    "source": {
      "description": "What the operator measured from.",
      "type": "object",
      "additionalProperties": false,
      "required": ["kind"],
      "properties": {
        "kind": {
          "description": "hand_sketch: a sketch drawn on site; existing_plan: a printed or drawn plan of the property; none: measurements only, no drawing.",
          "enum": ["hand_sketch", "existing_plan", "none"]
        },
        "path": {
          "description": "Package path of the sketch image (role sketch_image). Present exactly when kind is not none.",
          "$ref": "#/$defs/relativePath"
        }
      },
      "if": {
        "properties": {
          "kind": {
            "const": "none"
          }
        }
      },
      "then": {
        "not": {
          "properties": {
            "path": true
          },
          "required": ["path"]
        }
      },
      "else": {
        "properties": {
          "path": true
        },
        "required": ["path"]
      }
    },
    "ceilingHeight": {
      "description": "Floor-to-ceiling height of the floor, used by every room that has no ceilingHeight of its own. Omitted when the operator did not measure it: the solver then assumes 2440 mm and the capture is limited.",
      "$ref": "#/$defs/length"
    },
    "rooms": {
      "type": "array",
      "minItems": 1,
      "items": {
        "$ref": "#/$defs/room"
      }
    }
  },
  "$defs": {
    "uuid": {
      "description": "Lowercase RFC 9562 UUID.",
      "type": "string",
      "format": "uuid",
      "pattern": "^[0-9a-f]{8}-[0-9a-f]{4}-[0-9a-f]{4}-[0-9a-f]{4}-[0-9a-f]{12}$"
    },
    "areaKey": {
      "description": "Key of the floor or area in the capture record, for example floor-1.",
      "type": "string",
      "pattern": "^[a-z0-9]+(-[a-z0-9]+)*$",
      "maxLength": 64
    },
    "id": {
      "description": "Element id, unique within the file. The solver keeps these ids in the capture model.",
      "type": "string",
      "minLength": 1,
      "maxLength": 128
    },
    "relativePath": {
      "description": "Path relative to the package root, forward slashes, no '.' or '..' segments.",
      "type": "string",
      "minLength": 1,
      "maxLength": 1024,
      "pattern": "^(?!/)(?!.*//)(?!.*/$)(?!(.*/)?\\.{1,2}(/|$))[^\\\\\\x00-\\x1f]+$"
    },
    "enteredUnit": {
      "description": "Unit the operator entered the value in. ft_in is feet and inches, for example 24' 8\".",
      "enum": ["mm", "cm", "m", "in", "ft", "ft_in"]
    },
    "length": {
      "description": "One entered length. measured false is an \"about\" value the operator estimated by eye; the solver marks what it builds from it as estimated.",
      "type": "object",
      "additionalProperties": false,
      "required": ["valueMm", "enteredUnit", "enteredText", "measured"],
      "properties": {
        "valueMm": {
          "type": "number",
          "exclusiveMinimum": 0,
          "maximum": 200000
        },
        "enteredUnit": {
          "$ref": "#/$defs/enteredUnit"
        },
        "enteredText": {
          "description": "The value exactly as the operator entered it, in enteredUnit.",
          "type": "string",
          "minLength": 1,
          "maxLength": 40
        },
        "measured": {
          "description": "True when read from a tape or laser (or printed on the existing plan); false for an estimate.",
          "type": "boolean"
        }
      }
    },
    "roomType": {
      "enum": [
        "living_room",
        "dining_room",
        "kitchen",
        "bedroom",
        "bathroom",
        "closet",
        "hallway",
        "laundry",
        "office",
        "utility",
        "other"
      ]
    },
    "turn": {
      "description": "The corner at the end of a wall, where the next wall starts: left, a square convex corner (the outline turns 90 degrees left, counter-clockwise); right, a square re-entrant corner (90 degrees right, the inside corner of an L); unsquare, a corner that is not 90 degrees, measured by a diagonal across it. Absent means left.",
      "enum": ["left", "right", "unsquare"]
    },
    "room": {
      "type": "object",
      "additionalProperties": false,
      "required": ["id", "label", "walls", "diagonals", "openings"],
      "properties": {
        "id": {
          "$ref": "#/$defs/id"
        },
        "label": {
          "description": "Room name as the operator wrote it, for example Kitchen.",
          "type": "string",
          "minLength": 1,
          "maxLength": 100
        },
        "type": {
          "description": "What the room is used for, when the operator chose it.",
          "$ref": "#/$defs/roomType"
        },
        "walls": {
          "description": "The walls around the room in order, counter-clockwise seen from above as drawn. Corner i is the start of wall i; the last wall ends at corner 0.",
          "type": "array",
          "minItems": 3,
          "items": {
            "$ref": "#/$defs/wall"
          }
        },
        "diagonals": {
          "description": "Corner-to-corner distances measured through the room: one across each unsquare corner, or one for a squareness check. Empty when none.",
          "type": "array",
          "items": {
            "$ref": "#/$defs/diagonal"
          }
        },
        "openings": {
          "description": "Doors, windows and openings in this room's walls. Empty when none.",
          "type": "array",
          "items": {
            "$ref": "#/$defs/opening"
          }
        },
        "ceilingHeight": {
          "description": "This room's ceiling height when it differs from the floor's.",
          "$ref": "#/$defs/length"
        }
      }
    },
    "wall": {
      "type": "object",
      "additionalProperties": false,
      "required": ["id"],
      "properties": {
        "id": {
          "$ref": "#/$defs/id"
        },
        "length": {
          "description": "The wall's length along the inside face. Omitted when the operator did not enter one: the solver fills it from closure when it can, else from an estimate.",
          "$ref": "#/$defs/length"
        },
        "turn": {
          "$ref": "#/$defs/turn"
        },
        "exterior": {
          "description": "True for an exterior wall (drawn thicker, 6 in; interior walls are 4.5 in). Absent means interior.",
          "type": "boolean"
        },
        "sharedWith": {
          "description": "The wall of an earlier room in this file that is the other side of the same partition. The solver places this room against that one.",
          "type": "object",
          "additionalProperties": false,
          "required": ["roomId", "wallId"],
          "properties": {
            "roomId": {
              "$ref": "#/$defs/id"
            },
            "wallId": {
              "$ref": "#/$defs/id"
            }
          }
        }
      }
    },
    "diagonal": {
      "type": "object",
      "additionalProperties": false,
      "required": ["from", "to", "length"],
      "properties": {
        "from": {
          "description": "Index of the first corner (the start of wall from).",
          "type": "integer",
          "minimum": 0
        },
        "to": {
          "description": "Index of the second corner; not from or a neighbour of it.",
          "type": "integer",
          "minimum": 0
        },
        "length": {
          "$ref": "#/$defs/length"
        }
      }
    },
    "opening": {
      "type": "object",
      "additionalProperties": false,
      "required": ["id", "kind", "wallId", "fromCorner"],
      "properties": {
        "id": {
          "$ref": "#/$defs/id"
        },
        "kind": {
          "description": "door, a door; window, a window; opening, an opening without a door (passage, arch).",
          "enum": ["door", "window", "opening"]
        },
        "wallId": {
          "description": "The wall of this room the opening is in.",
          "$ref": "#/$defs/id"
        },
        "width": {
          "description": "Clear width. Omitted: the solver uses 914 mm for a door and 1219 mm for a window or opening, estimated.",
          "$ref": "#/$defs/length"
        },
        "height": {
          "description": "Height of the opening. Omitted: 2032 mm for a door, 1219 mm for a window, the wall height for an opening, estimated.",
          "$ref": "#/$defs/length"
        },
        "sill": {
          "description": "Windows: height of the sill above the floor. Omitted: 914 mm, estimated. Doors and openings have no sill.",
          "$ref": "#/$defs/length"
        },
        "fromCorner": {
          "description": "Which corner of the wall fromCornerDistance is measured from: start, the wall's start corner; end, its end corner.",
          "enum": ["start", "end"]
        },
        "fromCornerDistance": {
          "description": "Distance from that corner to the nearest jamb of the opening. Omitted: the opening is placed by the order of the openings on the wall, estimated.",
          "$ref": "#/$defs/length"
        }
      },
      "if": {
        "properties": {
          "kind": {
            "const": "window"
          }
        }
      },
      "else": {
        "not": {
          "properties": {
            "sill": true
          },
          "required": ["sill"]
        }
      }
    }
  }
}
